{
  "schema_version": 1,
  "case_id": "SYNTHETIC-001",
  "data_class": "synthetic",
  "age_years": 62,
  "sex_at_birth": "female",
  "specimen_site": "liver biopsy",
  "findings": [
    {"id": "F1", "kind": "histology", "name": "morphology", "value": "adenocarcinoma"},
    {"id": "F2", "kind": "ihc", "name": "CK7", "value": "positive"},
    {"id": "F3", "kind": "ihc", "name": "CK20", "value": "negative"},
    {"id": "F4", "kind": "clinical", "name": "primary-site workup", "value": "primary site has not been established"}
  ]
}
